ElementName,DataDescription,StartPosition,EndPosition,DataLength,Format,Comments,ReceivedClaimFactColumnName,ReceivedClaimProcedureFactColumnName,ReceivedClaimMedicationFactColumnName
CUR_CLM_UNIQ_ID,Current Unique Claim Identifier,1,13,13,9(13),A unique identification number assigned to the claim.,Id,"Id, ReceivedClaimId",
CLM_LINE_NUM,Claim Line Number,14,23,10,9(10),A sequential number that identifies a specific claim line within a given claim.,,Id,
BENE_HIC_NUM,Beneficiary HIC Number,24,34,11,X(11),"A beneficiary identifier. The HICN that appears in this field is the beneficiary’s current HICN, not necessarily the HICN that was used to process the claim",PatientId,PatientId,
CLM_TYPE_CD,Claim Type Code,35,36,2,9(02),"Signifies the type of claim being submitted through the Medicare or Medicaid programs. Claim type codes are:
71=RIC O local carrier non-DMEPOS claim
72=RIC O local carrier DMEPOS claim",ReceivedClaimType,,
,,,,,,,,,
,,,,,,,,,
CLM_FROM_DT,Claim From Date,37,46,10,YYYY-MM-DD,The first day on the billing statement that covers services rendered to the beneficiary. Also known as the “Statement Covers From Date.”,StartDate,,
CLM_THRU_DT,Claim Thru Date,47,56,10,YYYY-MM-DD, The last day on the billing statement that covers services rendered to the beneficiary. Also known as the “Statement Covers Through Date.”,EndDate,,
RNDRG_PRVDR_TYPE_CD,Rendering Provider Type Code,57,59,3,X(03),"Indicates the type of provider who provided the service associated with this line item on the claim. Provider Type Codes are: 
0=Clinics, groups, associations, partnerships, or other entities
1=Physicians or suppliers reporting as solo practitioners
2=Suppliers (other than sole proprietorship)
3=Institutional provider
4=Independent laboratories
5=Clinics (multiple specialties)
6=Groups (single specialty)
7=Other entities",,,
RNDRG_PRVDR_FIPS_ST_CD,Rendering Provider FIPS State Code,60,61,2,X(02),Identifies the state that the provider providing the service is located in.,,,
CLM_PRVDR_SPCLTY_CD,Claim-Line Provider Specialty Code,62,63,2,X(02),Indicates the CMS specialty code associated with the provider of services. CMS used this number to price the service on the line-item. Find Provider Specialty Codes here: http://www.cms.gov/Medicare/Provider-Enrollment-and-Certification/MedicareProviderSupEnroll/downloads/JSMTDL-08515MedicarProviderTypetoHCPTaxonomy.pdf,,RenderingProviderSpecialty,
CLM_FED_TYPE_SRVC_CD,Claim Federal Type Service Code,64,64,1,X(01),"Indicates the type of service (e.g., consultation, surgery) provided to the beneficiary. Types of Service Codes are defined in the Medicare Carrier Manual. Find Types of Service Codes here: http://www.resdac.org/sites/resdac.org/files/CMS%20Type%20of%20Service%20Table.txt",,ServiceType,
CLM_POS_CD,Claim Place of Service Code,65,66,2,X(02),"Indicates the place where the indicated service was provided (e.g., ambulance, school). Places of service are defined in the Medicare Carrier Manual. Find Place of Service Codes here: http://www.resdac.org/sites/resdac.org/files/Place%20of%20Service%20Table.txt",,PlaceOfServiceType,
CLM_LINE_FROM_DT,Line Claim From Date,67,76,10,YYYY-MM-DD,The date the service associated with the line item began.,,PerformedStartDate,
CLM_LINE_THRU_DT,Line Claim Thru Date,77,86,10,YYYY-MM-DD,The date the service associated with the line item ended.,,PerformedEndDate,
CLM_LINE_HCPCS_CD,HCPCS Code,87,91,5,X(05),"The HCPCS code representing the procedure, supply, product, and/or service provided to the beneficiary.",,"ProcedureCodeType, ProcedureCode, ProcedureId",
CLM_LINE_CVRD_PD_AMT,Claim Line Covered Paid Amount,92,106,15,-9(11).99,The amount of payment made by Medicare on behalf of the beneficiary for the indicated service after deductible and coinsurance amounts have been paid.,TotalInsuranceAmount,InsuranceAmount,
CLM_PRMRY_PYR_CD,Claim Primary Payer Code,107,107,1,X(01),"If a payer other than Medicare has primary responsibility for payment of the service indicated on the claim line, this code indicates the primary payer. This field is also known as the Line Beneficiary Primary Payer Code. If this field is blank, Medicare is the primary payer for the beneficiary. Find Primary Payer Codes here: http://www.resdac.org/cms-data/variables/Line-Beneficiary-Primary-Payer-Code","PrimaryCoverageId, SecondCoverageId","PrimaryCoverageId, SecondCoverageId",
CLM_LINE_DGNS_CD,Diagnosis Code,108,114,7,X(07),The ICD-9/10 diagnosis code identifying the beneficiary’s principal illness or disability.,,,
CLM_RNDRG_PRVDR_TAX_NUM,Claim Provider Tax Number,115,124,10,X(10),The SSN or Employee Identification Number (EIN) of the provider of the indicated service. This number identifies who receives payment for the indicated service.,,,
RNDRG_PRVDR_NPI_NUM,Rendering Provider NPI Number,125,134,10,X(10),A number that identifies the provider rendering the indicated service on the claim line. Each provider is assigned its own unique NPI.,,RenderingProviderId,
CLM_CARR_PMT_DNL_CD,Claim Carrier Payment Denial Code,135,136,2,X(02),"Indicates to whom payment was made (e.g., physician, beneficiary), or if the claim was denied. Find Carrier Payment Denial Codes here: http://www.resdac.org/sites/resdac.org/files/Carrier%20Claim%20Payment%20Denial%20Table.txt",,,
CLM_PRCSG_IND_CD,Claim-Line Processing Indicator Code,137,138,2,X(02),Indicates whether the service indicated on the claim line was allowed or the reason it was denied. Find Processing Indicator Codes here: http://www.resdac.org/sites/resdac.org/files/Line%20Processing%20Indicator%20Table.txt,,,
CLM_ADJSMT_TYPE_CD,Claim Adjustment Type Code,139,140,2,X(02),"Indicates whether the claim an original, cancelation, or adjustment claim. Claim Adjustment Type Codes are:
0=Original Claim
1=Cancelation Claim
2=Adjustment claim",,,
CLM_EFCTV_DT,Claim Effective Date,141,150,10,YYYY-MM-DD,The date the claim was processed and added to the NCH. This is also referred to as the NCH Weekly Processing Date.,,,
CLM_IDR_LD_DT,Claim IDR Load Date,151,160,10,YYYY-MM-DD,When the claim was loaded into the IDR.,,,
CLM_CNTL_NUM,Claim Control Number,161,200,40,X(40),A unique number assigned to a claim by the Medicare carrier. This number allows CMS to associate each line item with its respective claim.,,,
BENE_EQTBL_BIC_HICN_NUM,Beneficiary Equitable BIC HICN Number,201,211,11,X(11),"This number is an “umbrella” HICN that groups certain HICNs together at the beneficiary level. For example, if a beneficiary’s spouse becomes widowed, the HICN will change, but the Beneficiary Equitable BIC HICN will not. This groups the pre- and post-widow status HICNs together. Note that the ONLY use of this field is to link together claims that all represent the same event using the natural key.",,,
CLM_LINE_ALOWD_CHRG_AMT,Claim Line Allowed Charges Amount,212,228,17,"""-9(13).99""",The amount Medicare approved for payment to the provider.,TotalAllowedAmount,AllowedAmount,
CLM_LINE_ALOWD_UNIT_QTY,Claim Line Allowed Unit Quantity,229,239,11,"""-9(7).99""","Count of total units, at the line-item level, associated with services needing unit reporting (e.g., anesthesia time units and blood units).",,Quantity,
HCPCS_1_MDFR_CD,HCPCS First Modifier Code,240,241,2,X(2),The first code to modify the HCPCS procedure code associated with the claim-line. This provides more specific procedure identification for the line item service.,,FirstModifier,
HCPCS_2_MDFR_CD,HCPCS Second Modifier Code,242,243,2,X(2),The second code to modify the HCPCS procedure code associated with the claim-line. This provides more specific procedure identification for the line item service.,,SecondModifier,
HCPCS_3_MDFR_CD,HCPCS Third Modifier Code,244,245,2,X(2),The third code to modify the HCPCS procedure code associated with the claim-line. This provides more specific procedure identification for the line item service.,,ThirdModifier,
HCPCS_4_MDFR_CD,HCPCS Fourth Modifier Code,246,247,2,X(2),The fourth code to modify the HCPCS procedure code associated with the claim-line. This provides more specific procedure identification for the line item service.,,FourthModifier,
HCPCS_5_MDFR_CD,HCPCS Fifth Modifier Code,248,249,2,X(2),The fifth code to modify the HCPCS procedure code associated with the claim-line. This provides more specific procedure identification for the line item service.,,,
CLM_DISP_CD,Claim Disposition Code,250,251,2,X(2),"Information regarding payment actions on the claim. Claim Disposition Codes are:
01=Debit accepted
02=Debit accepted (automatic adjustment)
03=Cancel accepted",,,
CLM_DGNS_1_CD,Claim Diagnosis First Code,252,258,7,X(7),The first of eight allowable ICD-9/10 diagnosis codes identifying the beneficiary’s illness or disability.,"DiagnosisComboKey, DiagnosisProfileDim columns","DiagnosisComboKey, DiagnosisProfileDim columns",
CLM_DGNS_2_CD,Claim Diagnosis Second Code,259,265,7,X(7),The second of eight allowable ICD-9/10 diagnosis codes identifying the beneficiary’s illness or disability.,"DiagnosisComboKey, DiagnosisProfileDim columns","DiagnosisComboKey, DiagnosisProfileDim columns",
CLM_DGNS_3_CD,Claim Diagnosis Third Code,266,272,7,X(7),The third of eight allowable ICD-9/10 diagnosis codes identifying the beneficiary’s illness or disability.,"DiagnosisComboKey, DiagnosisProfileDim columns","DiagnosisComboKey, DiagnosisProfileDim columns",
CLM_DGNS_4_CD,Claim Diagnosis Fourth Code,273,279,7,X(7),The fourth of eight allowable ICD-9/10 diagnosis codes identifying the beneficiary’s illness or disability.,"DiagnosisComboKey, DiagnosisProfileDim columns","DiagnosisComboKey, DiagnosisProfileDim columns",
CLM_DGNS_5_CD,Claim Diagnosis Fifth Code,280,286,7,X(7),The fifth of eight allowable ICD-9/10 diagnosis codes identifying the beneficiary’s illness or disability.,"DiagnosisComboKey, DiagnosisProfileDim columns",DiagnosisComboKey,
CLM_DGNS_6_CD,Claim Diagnosis Sixth Code,287,293,7,X(7),The sixth of eight allowable ICD-9/10 diagnosis codes identifying the beneficiary’s illness or disability.,"DiagnosisComboKey, DiagnosisProfileDim columns",DiagnosisComboKey,
CLM_DGNS_7_CD,Claim Diagnosis Seventh Code,294,300,7,X(7),The seventh of eight allowable ICD-9/10 diagnosis codes identifying the beneficiary’s illness or disability.,DiagnosisComboKey,DiagnosisComboKey,
CLM_DGNS_8_CD,Claim Diagnosis Eighth Code,301,307,7,X(7),The eighth of eight allowable ICD-9/10 diagnosis codes identifying the beneficiary’s illness or disability.,DiagnosisComboKey,DiagnosisComboKey,
